,id,publication,title,author,date,body,Henk Bodrogi,Elian Karel,Silvia Marek,Mandor Vann,Isia Vann,Lucio Jakab,Lorenzo Di Stefano,POK,GAStech
665,698,All News Today,POK REMEMBERS MARTYRED LEADER,,2012-06-20,"ABILA, Kronos - In a touching ceremony Wednesday leaders of the activist group Protectors of Kronos paid tribute to their fallen leader, Elian Karel, who was murdered on 19 June 2009 while being illegally detained in a Kronos jail.
""Today we gather to remember Elian Karel,"" Silvia Marek told the rapt assembly, many of whom held up white candles in Karel's honor.
""Elian was born on an Elodis farm not 40 minutes from here, to Jeroen and Antaura Karel. By the time Elian was 17 many of his family members and friends were battling constant illness, including his neighbor 10-year old Juliana Vann.""
""Elian devoted his life to the people of Elodis as well as all citizens of Kronos, as did his father before him. Elian knew his would be a difficult journey. He had watched his father, Jeroen and the founder of the POK, Henk Bodrogi walk the very path he would tread. Elian knew the course would not be easy, and would leave little time for a personal life.
""Elian's journey ended three years ago today.
Over the course of the afternoon several other speakers paid tribute to not only Elian, but all who have been victims of the environmental catastrophe brought about by greed and corruption of public officials. The police agitated many of the crowd, causing them to have to leave the assembly rather than be assailed with batons and pepper spray.",1,1,1,0,0,0,0,1,0
20,116,The Wrap,POK REMIND LEADER MARTYRED,,2012-06-21,"ABILA, Kronos - in LEADERs of moving ceramics Wednesday of activist the group guards of Kronos homage paid to their cases LEADER, Elian Karel, who on 19 June 2009 whereas resistance worker is held in a prison Kronos assassination.
We collect us today to remind Elian Karel, Silvia Marek told rap assembly, much of which supported white candles in the honor of Karel.
Elian were on an agriculture company Elodis of this born not 40 minutes, to Jeroen and Antaura Karel. He grew with the phantom of dead around him. By the time that Elian 17 much of its family members and the friends constant sickness vochten, including its neighbor 10 were years - old Juliana Vann.
Marek paused a moment to permit the shouts of Juliana! to remind to disappear slowly.
Elian are devoted life to people of Elodis as well as all citizens of Kronos, such as its father by him. Elian knew a difficult travel of him would be. He had on its father, Jeroen and the founder of POK, the pace of Henk Bodrogi actual gone paid attention which he would enter. Elian did not know the cursus easy, would be and little time for personal living would leave. But nevertheless he preferred those taking measures in spite of the challenges which he he. under eyes see will have blamed
Travel three years concluded of Elian suffered today. But is not dream died with him. And it is that vision of healthy and we must honor thriving future for all here today.
In the course of the afternoon different other participants not only paid homage to Elian, but everyone who victims of the milieucatastrofe who become by cupidity and corruption of public civil servants are brought about have been.
Collecting was brought in the war only by the worsening presence of police force Abila in babbling couples. The police force acted much of the mob, causing them the assembly must left rather than with batons and pepernevel are stormed.",1,1,1,0,0,0,0,1,0
626,662,The Orb,POK SE POINTS OUT THE CHIEF OF MARTYRED,,2012-06-22,"ABILA, Kronos - in the chiefs moving one Wednesday of ceremony of the guards of group of activist of Kronos poured the homage on their fallen chief, Elian Karel, which was assassinated on June 19, 2009 while being illegally held in prison of Kronos.
""Today we meet to point out Elian Karel to us,"" Silvia Marek said the enthumansiaste, much which delayed the white candles in the honor of Karel.
""Elian was constant with a farm of Elodis not 40 minutes from here, in Jeroen and Antaura Karel. It grew with the spectrum of dead all around him. Before Elian was 17 several of its members of family and the friends fought the constant disease, including its neighbor 10 years - old man Juliana Vann. "" 
Marek made a pause one moment to allow the cries of ""remember Juliana!"" to fade.
""Elian devoted its life to the people of Elodis as well as all the citizens of Kronos, just as his/her father before him. Elian knew that his would be a difficult voyage. It had observed his father, Jeroen and the founder of the POK, walk of Henk Bodrogi the way even as it would go. Elian knew that the course would not be easy, and would leave little time during a personal life. However it chose to take these measurements in spite of the challenges which it knew that it would face.""
The ""voyage of Elian finished three years ago of today. But its dream did not die with him. And it is this vision of healthy and future thrives for all we are here today to honor.""
In afternoon several other loudspeakers paid homage not only to Elian, but all what were victims of the environmental catastrophe caused by avarice and corruption of the public civils servant.
The gathering was disturbed only by the presence of aggravation of the police force of Abila in the speed of riot. The police force agitated much crowd, involving them to have to leave the assembly rather than to be invaded with the sticks and the jet of pepper.",1,1,1,0,0,0,0,1,0
526,572,Daily Pegasus,POK REMEMBERS MARTYRED LEADER,,2012-06-22,"ABILA, Kronos - in the stirring leaders of Wednesday of the ceremony of the protectors of the group of the activist of Kronos the tribute paid to its fallen leader, Elian Karel, that was assassinated the 19 of June of 2009 whereas illegal one being stopped in a jail of Kronos.
""We collected today to remember Elian Karel,"" Silvia Marek we said the assembly of rapt, many of whom supported the white candles in the honor of Karel.
""Elian was taken in a farm of Elodis not 40 minutes of here, to Jeroen and Antaura Karel. It grew above for with the phantom of the death everything around him. For the moment at which Elian was 17 many of their members of the family and the friends fought constant disease, including their neighbor 10 years - old Julian Vann. ""
Marek stopped briefly a little while to allow the shouts of ""remembers Julian"" to descolorar itself.
Elian knew that his it would be a difficult trip. He had watched his father, to Jeroen and founder of the POK, long walk of Henk Bodrogi the same trajectory that he would be above. Elian knew that the course would not be easy, and that it would leave just a short time by a personal life. He chose yet to take those measures in spite of the challenges that he knew that he would do in front. ""
The ""trip of Elian finished three years ago today. But its dream did not die with him. And it is that vision of a healthy one and future prosperous for all we are here today honoring.""
On the course of afternoon several other loudspeakers they paid tribute not only to Elian, but all that have been victims of the environmental catastrophe caused by avarice and the corruption of civil employees.
The meeting was only spoiled by the aggravating presence of the police of Abila in gear of the uproar. The police shook to many of the crowd, doing to have them to leave the assembly rather that to invade with the command batons and the aerosol of the pepper.",1,1,1,0,0,0,0,1,0
